acm,937599,Removing permissions in the flexible authorization framework,"Duminda Wijesekera, Sushil Jajodia, Francesco Parisi-Presicce, &#197;sa Hagstr&#246;m",ACM Transactions on Database Systems (TODS),2003,,,,,,,,
dblp,conf/vldb/DeutschT03,MARS: A System for Publishing XML from Mixed and Redundant Storage,"Alin Deutsch, Val Tannen",VLDB,2003,,,,,,,,
acm,603881,Influential papers,Ken Ross,ACM SIGMOD Record,2001,,,,,,,,
acm,673326,Information Retrieval from an Incomplete Data Cube,Curtis E. Dyreson,Very Large Data Bases,1996,,,,,,,,
dblp,conf/vldb/PellenkoftLK97,The Complexity of Transformation-Based Join Enumeration,"César A. Galindo-Legaria, Martin L. Kersten, Arjan Pellenkoft",VLDB,1997,,,,,,,,
dblp,conf/sigmod/Shyy95,VERSANT Replication: Supporting Fault-Tolerant Object Databases,"H. Stephen Au-Yeung, C. P. Chou, Yuh-Ming Shyy",SIGMOD Conference,1995,,,,,,,,
acm,202669,An annotated bibliography on active databases (short version),"Ulrike Jaeger, Johann Christoph Freytag",ACM SIGMOD Record,1995,,,,,,,,
dblp,conf/sigmod/ZhangRL96,BIRCH: An Efficient Data Clustering Method for Very Large Databases,"Raghu Ramakrishnan, Miron Livny, Tian Zhang",SIGMOD Conference,1996,,,,,,,,
dblp,conf/sigmod/CeriFPP95,The Algres Testbed of CHIMERA: An Active Object-Oriented Database System,"Giuseppe Psaila, Stefano Ceri, Stefano Paraboschi, Piero Fraternali",SIGMOD Conference,1995,,,,,,,,
dblp,conf/sigmod/Ross00,Expressing Business Rules,Ronald G. Ross,SIGMOD Conference,2000,,,,,,,,
dblp,journals/sigmod/BusslerFM02,A Conceptual Architecture for Semantic Web Enabled Web Services,"Dieter Fensel, Alexander Maedche, Christoph Bussler",SIGMOD Record,2002,,,,,,,,
dblp,conf/vldb/Toivonen96,Sampling Large Databases for Association Rules,Hannu Toivonen,VLDB,1996,,,,,,,,
dblp,conf/vldb/BernsteinD94,An Overview of Repository Technology,"Philip A. Bernstein, Umeshwar Dayal",VLDB,1994,,,,,,,,
dblp,conf/sigmod/Bampahl95,Real World Requirements for Decision Support - Implications for RDBMS,Sanju K. Bansal,SIGMOD Conference,1995,,,,,,,,
acm,604271,Using unknowns to prevent discovery of association rules,"Y&#252;cel Saygin, Vassilios S. Verykios, Chris Clifton",ACM SIGMOD Record,2001,,,,,,,,
dblp,conf/sigmod/Cotton02,Implementing XQuery,Paul Cotton,SIGMOD Conference,2002,,,,,,,,
acm,671528,The Value of Merge-Join and Hash-Join in SQL Server,Goetz Graefe,Very Large Data Bases,1999,,,,,,,,
acm,227624,Magic conditions,"Inderpal Singh Mumick, Sheldon J. Finkelstein, Hamid Pirahesh, Raghu Ramakrishnan",ACM Transactions on Database Systems (TODS),1996,,,,,,,,
acm,765563,EXACT: an extensible approach to active object-oriented databases,"Oscar D&#237;az, Arturo Jaime",The VLDB Journal &mdash, The International Journal on Very Large Data Bases,1997,,,,,,,
dblp,journals/sigmod/RossNO03,Reminiscences on Influential Papers,"Kenneth A. Ross, Beng Chin Ooi, Frank Neven",SIGMOD Record,2003,,,,,,,,
dblp,conf/vldb/LempelM02,Optimizing Result Prefetching in Web Search Engines with Segmented Indices,"Shlomo Moran, Ronny Lempel",VLDB,2002,,,,,,,,
dblp,conf/sigmod/AdelbergD99,Nodose Version 2.0,"Brad Adelberg, Matthew Denny",SIGMOD Conference,1999,,,,,,,,
acm,564770,Visual COKO: a debugger for query optimizer development,"Daniel J. Abadi, Mitch Cherniack",International Conference on Management of Data,2002,,,,,,,,
dblp,journals/vldb/JagadishACLNPPSWWY02,TIMBER: A native XML database,"Andrew Nierman, Cong Yu, Jignesh M. Patel, Adriane Chapman, Nuwee Wiwatwattana, H. V. Jagadish, Yuqing Wu, Laks V. S. Lakshmanan, Divesh Srivastava, Shurug Al-Khalifa, Stelios Paparizos",VLDB J.,2002,,,,,,,,
acm,564695,An adaptive peer-to-peer network for distributed caching of OLAP results,"Panos Kalnis, Wee Siong Ng, Beng Chin Ooi, Dimitris Papadias, Kian-Lee Tan",International Conference on Management of Data,2002,,,,,,,,
dblp,conf/sigmod/LoR96,Spatial Hash-Joins,"Ming-Ling Lo, Chinya V. Ravishankar",SIGMOD Conference,1996,,,,,,,,
dblp,conf/vldb/ChenRS95,Declustering Databases on Heterogeneous Disk Systems,"Doron Rotem, Sridhar Seshadri, Ling Tony Chen",VLDB,1995,,,,,,,,
dblp,conf/sigmod/CasatiS01,Models and Languages for Describing and Discovering E-Services,"Ming-Chien Shan, Fabio Casati",SIGMOD Conference,2001,,,,,,,,
acm,640994,A multi-paradigm querying approach for a generic multimedia database management system,"Ji-Rong Wen, Qing Li, Wei-Ying Ma, Hong-Jiang Zhang",ACM SIGMOD Record,2003,,,,,,,,
dblp,conf/vldb/XinHLW03,Star-Cubing: Computing Iceberg Cubes by Top-Down and Bottom-Up Integration,"Jiawei Han, Xiaolei Li, Benjamin W. Wah, Dong Xin",VLDB,2003,,,,,,,,
dblp,conf/vldb/PedersenJD99,Extending Practical Pre-Aggregation in On-Line Analytical Processing,"Torben Bach Pedersen, Curtis E. Dyreson, Christian S. Jensen",VLDB,1999,,,,,,,,
dblp,conf/vldb/ChangG00,Approximate Query Translation Across Heterogeneous Information Sources,"Hector Garcia-Molina, Kevin Chen-Chuan Chang",VLDB,2000,,,,,,,,
dblp,conf/sigmod/MeccaAMMS98,The Araneus Web-Base Management System,"Giansalvatore Mecca, Paolo Merialdo, Alessandro Masci, Paolo Atzeni, Giuseppe Sindoni",SIGMOD Conference,1998,,,,,,,,
acm,280362,BeSS: storage support for interactive visualization systems,"A. Biliris, T. A. Funkhouser, W. O'Connell, E. Panagos",International Conference on Management of Data,1996,,,,,,,,
dblp,journals/sigmod/Hampapur99,Semantic Video Indexing: Approach and Issue,Arun Hampapur,SIGMOD Record,1999,,,,,,,,
acm,673000,Dali: A High Performance Main Memory Storage Manager,"H. V. Jagadish, Daniel F. Lieuwen, Rajeev Rastogi, Abraham Silberschatz, S. Sudarshan",Very Large Data Bases,1994,,,,,,,,
