acm,181560,A consensus glossary of temporal database concepts,"Curtis Dyreson, Fabio Grandi, Wolfgang K&#228;fer, Nick Kline, Nikos Lorentzos, Yannis Mitsopoulos, Angelo Montanari, Daniel Nonen, Elisa Peressi, Barbara Pernici, John F. Roddick, Nandlal L. Sarda, Maria Rita Scalas, Arie Segev, Richard Thomas Snodgrass, Mike D. Soo, Abdullah Tansel, Paolo Tiberio, Gio Wiederhold",ACM SIGMOD Record,1994,,,,,,,,
dblp,conf/sigmod/Golding95,Things Every Update Replication Customer Should Know,Rob Golding,SIGMOD Conference,1995,,,,,,,,
acm,764223,Optimizing multiple dimensional queries simultaneously in multidimensional databases,"Weifa Liang, Maria E. Orlowska, Jeffrey X. Yu",The VLDB Journal &mdash, The International Journal on Very Large Data Bases,2000,,,,,,,
dblp,journals/sigmod/Bernstein01,Report on the 2001 SIGMOD and PODS Awards,Philip A. Bernstein,SIGMOD Record,2001,,,,,,,,
dblp,conf/sigmod/IpeirotisGS01,"Probe, Count, and Classify: Categorizing Hidden Web Databases","Mehran Sahami, Panagiotis G. Ipeirotis, Luis Gravano",SIGMOD Conference,2001,,,,,,,,
dblp,journals/sigmod/BargaL02,Phoenix Project: Fault-Tolerant Applications,"Roger S. Barga, David B. Lomet",SIGMOD Record,2002,,,,,,,,
acm,671331,MindReader: Querying Databases Through Multiple Examples,"Yoshiharu Ishikawa, Ravishankar Subramanya, Christos Faloutsos",Very Large Data Bases,1998,,,,,,,,
acm,335465,Handling very large databases with informix extended parallel server,Andreas Weininger,International Conference on Management of Data,2000,,,,,,,,
dblp,journals/vldb/AnGSVKI02,Energy-performance trade-offs for spatial access methods on memory-resident data,"Mahmut T. Kandemir, Ning An, Mary Jane Irwin, Anand Sivasubramaniam, Sudhanva Gurumurthi, Narayanan Vijaykrishnan",VLDB J.,2002,,,,,,,,
acm,758376,Author Index,,Very Large Data Bases,2000,,,,,,,,
dblp,conf/sigmod/GillmannWSWW00,A Goal-driven Auto-Configuration Tool for the Distributed Workflow Management System Mentor-lite,"German Shegalov, Gerhard Weikum, Wolfgang Wonner, Michael Gillmann, Jeanine Weißenfels",SIGMOD Conference,2000,,,,,,,,
acm,191884,AlphaSort: a RISC machine sort,"Chris Nyberg, Tom Barclay, Zarka Cvetanovic, Jim Gray, Dave Lomet",International Conference on Management of Data,1994,,,,,,,,
acm,765541,Approximate similarity retrieval with M-trees,"Pavel Zezula, Pasquale Savino, Giuseppe Amato, Fausto Rabitti",The VLDB Journal &mdash, The International Journal on Very Large Data Bases,1998,,,,,,,
acm,375673,Mining needle in a haystack: classifying rare classes via two-phase rule induction,"Mahesh V. Joshi, Ramesh C. Agarwal, Vipin Kumar",International Conference on Management of Data,2001,,,,,,,,
dblp,conf/sigmod/Seshadri03,Building Notification Services with Microsoft SQLServer,Praveen Seshadri,SIGMOD Conference,2003,,,,,,,,
acm,671175,DataBlitz: A High Performance Main-Memory Storage Manager,"Jerry Baulier, Philip Bohannon, S. Gogate, S. Joshi, C. Gupta, A. Khivesera, Henry F. Korth, Peter McIlroy, J. Miller, P. P. S. Narayan, M. Nemeth, Rajeev Rastogi, Abraham Silberschatz, S. Sudarshan",Very Large Data Bases,1998,,,,,,,,
dblp,conf/vldb/ZengBNN01,AgFlow: Agent-based Cross-Enterprise Workflow Management System,"Boualem Benatallah, Anne H. H. Ngu, Phuong Nguyen, Liangzhao Zeng",VLDB,2001,,,,,,,,
acm,375665,On computing correlated aggregates over continual data streams,"Johannes Gehrke, Flip Korn, Divesh Srivastava",International Conference on Management of Data,2001,,,,,,,,
dblp,conf/vldb/SchaeferBBJ00,Controlling Data Warehouses with Knowledge Networks,"Jan-Dirk Becker, Matthias Jarke, Andreas Boehmer, Elvira Schaefer",VLDB,2000,,,,,,,,
acm,245886,"In reply to Domains, relations and religious wars",Hugh Darwen,ACM SIGMOD Record,1996,,,,,,,,
acm,375664,Efficient computation of Iceberg cubes with complex measures,"Jiawei Han, Jian Pei, Guozhu Dong, Ke Wang",International Conference on Management of Data,2001,,,,,,,,
dblp,conf/vldb/GardarinGT95,A Cost Model for Clustered Object-Oriented Databases,"Zhao-Hui Tang, Jean-Robert Gruser, Georges Gardarin",VLDB,1995,,,,,,,,
dblp,journals/tods/ChrysanthisR94,Synthesis of Extended Transaction Models Using ACTA,"Panos K. Chrysanthis, Krithi Ramamritham",ACM Trans. Database Syst.,1994,,,,,,,,
acm,764201,TIMBER: A native XML database,"H. V. Jagadish, S. Al-Khalifa, A. Chapman, L. V. S. Lakshmanan, A. Nierman, S. Paparizos, J. M. Patel, D. Srivastava, N. Wiwatwattana, Y. Wu, C. Yu",The VLDB Journal &mdash, The International Journal on Very Large Data Bases,2002,,,,,,,
acm,671679,The Evolution of the Web and Implications for an Incremental Crawler,"Junghoo Cho, Hector Garcia-Molina",Very Large Data Bases,2000,,,,,,,,
acm,672177,An Extendible Hash for Multi-Precision Similarity Querying of Image Databases,"Shu Lin, M. Tamer &#214;zsu, Vincent Oria, Raymond T. Ng",Very Large Data Bases,2001,,,,,,,,
acm,615237,AlphaSort: a cache-sensitive parallel external sort,"Chris Nyberg, Tom Barclay, Zarka Cvetanovic, Jim Gray, Dave Lomet",The VLDB Journal &mdash, The International Journal on Very Large Data Bases,1995,,,,,,,
dblp,conf/sigmod/HristidisKP01,PREFER: A System for the Efficient Execution of Multi-parametric Ranked Queries,"Yannis Papakonstantinou, Vagelis Hristidis, Nick Koudas",SIGMOD Conference,2001,,,,,,,,
acm,276364,A data mining application: customer retention at the Port of Singapore Authority (PSA),"KianSing Ng, Huan Liu, HweeBong Kwah",International Conference on Management of Data,1998,,,,,,,,
dblp,journals/vldb/SivasankaranSTPR96,Priority Assignment in Real-Time Active Databases,"Rajendran M. Sivasankaran, Bhaskar Purimetla, John A. Stankovic, Krithi Ramamritham, Donald F. Towsley",VLDB J.,1996,,,,,,,,
acm,333612,On mutli-resolution document transmission in mobile Web,"Stanley M. T. Yau, Hong Va Leong, Dennis McLeod, Antonio Si",ACM SIGMOD Record,1999,,,,,,,,
dblp,conf/sigmod/BergstraesserBPS99,Versions and Workspaces in Microsoft Repository,"Shankar Pal, Thomas Bergstraesser, Philip A. Bernstein, David Shutt",SIGMOD Conference,1999,,,,,,,,
dblp,journals/sigmod/PitouraAPSV03,DBGlobe: a service-oriented P2P system for global computing,"Evaggelia Pitoura, Serge Abiteboul, Michalis Vazirgiannis, Dieter Pfoser, George Samaras",SIGMOD Record,2003,,,,,,,,
dblp,journals/tods/LitwinN96,"LH* - A Scalable, Distributed Data Structure","Donovan A. Schneider, Marie-Anne Neimat, Witold Litwin",ACM Trans. Database Syst.,1996,,,,,,,,
dblp,journals/sigmod/RosenthalHRS97,A Consumer Viewpoint on Mediator Languages - a Proposal for a Standard,"Eric Hughes, Leonard J. Seligman, Arnon Rosenthal, Scott Renner",SIGMOD Record,1997,,,,,,,,
dblp,conf/vldb/PolyzotisG02,Structure and Value Synopses for XML Data Graphs,"Neoklis Polyzotis, Minos N. Garofalakis",VLDB,2002,,,,,,,,
dblp,conf/vldb/Bowker00,Work and Information Practices in the Sciences of Biodiversity,Geoffrey C. Bowker,VLDB,2000,,,,,,,,
dblp,conf/sigmod/WhiteD94,QuickStore: A High Performance Mapped Object Store,"David J. DeWitt, Seth J. White",SIGMOD Conference,1994,,,,,,,,
acm,872825,Adaptive filters for continuous queries over distributed data streams,"Chris Olston, Jing Jiang, Jennifer Widom",International Conference on Management of Data,2003,,,,,,,,
dblp,conf/vldb/CotterB00,Biodiversity Informatics Infrastructure: An Information Commons for the Biodiversity Community,"Barbara T. Bauldock, Gladys A. Cotter",VLDB,2000,,,,,,,,
dblp,journals/sigmod/Suciu01,On Database Theory and XML,Dan Suciu,SIGMOD Record,2001,,,,,,,,
acm,219737,View maintenance in mobile computing,"Ouri Wolfson, Prasad Sistla, Son Dao, Kailash Narayanan, Ramya Raj",ACM SIGMOD Record,1995,,,,,,,,
dblp,conf/vldb/Mohan02a,An Efficient Method for Performing Record Deletions and Updates Using Index Scans,C. Mohan,VLDB,2002,,,,,,,,
dblp,conf/sigmod/ArasuBBDIRW03,STREAM: The Stanford Stream Data Manager,"Jennifer Widom, Mayur Datar, Shivnath Babu, Justin Rosenstein, Itaru Nishizawa, Arvind Arasu, Keith Ito, Brian Babcock",SIGMOD Conference,2003,,,,,,,,
acm,671201,Incremental Clustering for Mining in a Data Warehousing Environment,"Martin Ester, Hans-Peter Kriegel, J&#246;rg Sander, Michael Wimmer, Xiaowei Xu",Very Large Data Bases,1998,,,,,,,,
dblp,journals/sigmod/YaoG02,The Cougar Approach to In-Network Query Processing in Sensor Networks,"Johannes Gehrke, Yong Yao",SIGMOD Record,2002,,,,,,,,
dblp,conf/sigmod/AbadiC02,Visual COKO: a debugger for query optimizer development,"Daniel J. Abadi, Mitch Cherniack",SIGMOD Conference,2002,,,,,,,,
acm,672182,Aggregate Maintenance for Data Warehousing in Informix Red Brick Vista,"Craig J. Bunker, Latha S. Colby, Richard L. Cole, William J. McKenna, Gopal Mulagund, David Wilhite",Very Large Data Bases,2001,,,,,,,,
acm,673634,The Design and Implementation of a Sequence Database System,"Praveen Seshadri, Miron Livny, Raghu Ramakrishnan",Very Large Data Bases,1996,,,,,,,,
acm,304571,DBIS-toolkit: adaptable middleware for large scale data delivery,"Mehmet Altinel, Demet Aksoy, Thomas Baby, Michael Franklin, William Shapiro, Stan Zdonik",International Conference on Management of Data,1999,,,,,,,,
dblp,conf/sigmod/Mohan01,Application Servers: Born-Again TP Monitors for the Web? (Panel Abstract),C. Mohan,SIGMOD Conference,2001,,,,,,,,
acm,335463,Indexing images in Oracle8i,"Melliyal Annamalai, Rajiv Chopra, Samuel DeFazio, Susan Mavris",International Conference on Management of Data,2000,,,,,,,,
acm,777001,Standards,Andrew Eisenberg,ACM SIGMOD Record,2003,,,,,,,,
acm,601872,Industry perspectives,Len Seligman,ACM SIGMOD Record,2002,,,,,,,,
dblp,conf/sigmod/KanthRSB99,Indexing Medium-dimensionality Data in Oracle,"Jayant Sharma, Kothuri Venkata Ravi Kanth, Jay Banerjee, Siva Ravada",SIGMOD Conference,1999,,,,,,,,
acm,223886,The Algres testbed of CHIMERA: an active object-oriented database system,"Stefano Ceri, Piero Fraternali, Stefano Paraboschi, Giuseppe Psaila",International Conference on Management of Data,1995,,,,,,,,
dblp,conf/vldb/SteinbrunnPMK95,Bypassing Joins in Disjunctive Queries,"Alfons Kemper, Guido Moerkotte, Klaus Peithner, Michael Steinbrunn",VLDB,1995,,,,,,,,
dblp,conf/sigmod/SistlaW95,Temporal Conditions and Integrity Constraints in Active Database Systems,"Ouri Wolfson, A. Prasad Sistla",SIGMOD Conference,1995,,,,,,,,
acm,671341,Evaluating Functional Joins Along Nested Reference Sets in Object-Relational and Object-Oriented Databases,"Reinhard Braumandl, Jens Clau&#223;en, Alfons Kemper",Very Large Data Bases,1998,,,,,,,,
acm,375754,"COSIMA- your smart, speaking E-salesperson","Werner Kie&#946;ling, Stefan Holland, Stefan Fischer, Thorsten Ehm",International Conference on Management of Data,2001,,,,,,,,
dblp,conf/sigmod/GarofalakisG02,Wavelet synopses with error guarantees,"Phillip B. Gibbons, Minos N. Garofalakis",SIGMOD Conference,2002,,,,,,,,
acm,276361,The PointCast network (abstract),"Satish Ramakrishnan, Vibha Dayal",International Conference on Management of Data,1998,,,,,,,,
dblp,conf/vldb/Koch03,Efficient Processing of Expressive Node-Selecting Queries on XML Data in Secondary Storage: A Tree Automata-based Approach,Christoph Koch,VLDB,2003,,,,,,,,
dblp,conf/vldb/AgrawalLSS95,"Fast Similarity Search in the Presence of Noise, Scaling, and Translation in Time-Series Databases","King-Ip Lin, Harpreet S. Sawhney, Rakesh Agrawal, Kyuseok Shim",VLDB,1995,,,,,,,,
acm,767134,Designing wrapper components for e-services in integrating heterogeneous systems,"Massimo Mecella, Barbara Pernici",The VLDB Journal &mdash, The International Journal on Very Large Data Bases,2001,,,,,,,
dblp,journals/tods/TendickM94,A Modified Random Perturbation Method for Database Security,"Norman S. Matloff, Patrick Tendick",ACM Trans. Database Syst.,1994,,,,,,,,
dblp,conf/vldb/MeoPC96,A New SQL-like Operator for Mining Association Rules,"Giuseppe Psaila, Stefano Ceri, Rosa Meo",VLDB,1996,,,,,,,,
dblp,journals/sigmod/Snodgrass99,Chair's Message,Richard T. Snodgrass,SIGMOD Record,1999,,,,,,,,
dblp,conf/sigmod/BohannonDGKLNS03,ROLEX: Relational On-Line Exchange with XML,"Pradeep Shenoy, Xin Dong, Henry F. Korth, Philip Bohannon, P. P. S. Narayan, Chengkai Li, Sumit Ganguly",SIGMOD Conference,2003,,,,,,,,
dblp,journals/sigmod/dOnofrioP03,Modelling temporal thematic map contents,"Elaheh Pourabbas, Alberto d'Onofrio",SIGMOD Record,2003,,,,,,,,
dblp,journals/tods/MokNE96,A Normal Form for Precisely Characterizing Redundancy in Nested Relations,"Yiu-Kai Ng, David W. Embley, Wai Yin Mok",ACM Trans. Database Syst.,1996,,,,,,,,
dblp,conf/vldb/VeltriCV01,Views in a Large Scale XML Repository,"Dan Vodislav, Sophie Cluet, Pierangelo Veltri",VLDB,2001,,,,,,,,
dblp,conf/vldb/GingrasL98,nD-SQL: A Multi-Dimensional Language for Interoperability and OLAP,"Laks V. S. Lakshmanan, Frédéric Gingras",VLDB,1998,,,,,,,,
acm,363956,Theory of dependence values,Rosa Meo,ACM Transactions on Database Systems (TODS),2000,,,,,,,,
dblp,conf/sigmod/ParkCY95,An Effective Hash Based Algorithm for Mining Association Rules,"Ming-Syan Chen, Philip S. Yu, Jong Soo Park",SIGMOD Conference,1995,,,,,,,,
dblp,conf/vldb/SeifertS02,A Multi-version Cache Replacement and Prefetching Policy for Hybrid Data Delivery Environments,"André Seifert, Marc H. Scholl",VLDB,2002,,,,,,,,
acm,191929,Parallel database systems in the 1990's,Michael J. Carey,International Conference on Management of Data,1994,,,,,,,,
dblp,journals/sigmod/RossGN03,Reminiscences an Influential Papers,"Jeffrey F. Naughton, Minos N. Garofalakis, Kenneth A. Ross",SIGMOD Record,2003,,,,,,,,
dblp,conf/sigmod/Ojjeh99,Microsoft Site Server (Commerce Edition),Bassel Ojjeh,SIGMOD Conference,1999,,,,,,,,
acm,767144,Efficiently publishing relational data as XML documents,"Jayavel Shanmugasundaram, Eugene Shekita, Rimon Barr, Michael Carey, Bruce Lindsay, Hamid Pirahesh, Berthold Reinwald",The VLDB Journal &mdash, The International Journal on Very Large Data Bases,2001,,,,,,,
acm,671010,The Case for Enhanced Abstract Data Types,"Praveen Seshadri, Miron Livny, Raghu Ramakrishnan",Very Large Data Bases,1997,,,,,,,,
acm,945722,Analysis of SIGMOD's co-authorship graph,"Mario A. Nascimento, J&#246;rg Sander, Jeffrey Pound",ACM SIGMOD Record,2003,,,,,,,,
acm,615213,The software information base: a server for reuse,"Panos Constantopoulos, Matthias Jarke, John Mylopoulos, Yannis Vassiliou",The VLDB Journal &mdash, The International Journal on Very Large Data Bases,1995,,,,,,,
dblp,conf/vldb/BohmMSW01,Fast Evaluation Techniques for Complex Similarity Queries,"Michael Mlivoncic, Roger Weber, Klemens Böhm, Hans-Jörg Schek",VLDB,2001,,,,,,,,
dblp,journals/vldb/ChakrabartiGRS01,Approximate query processing using wavelets,"Rajeev Rastogi, Minos N. Garofalakis, Kyuseok Shim, Kaushik Chakrabarti",VLDB J.,2001,,,,,,,,
acm,565119,Bringing order to query optimization,"Giedrius Slivinskas, Christian S. Jensen, Richard Thomas Snodgrass",ACM SIGMOD Record,2002,,,,,,,,
acm,601861,The cougar approach to in-network query processing in sensor networks,"Yong Yao, Johannes Gehrke",ACM SIGMOD Record,2002,,,,,,,,
dblp,conf/vldb/LimWV03,SASH: A Self-Adaptive Histogram Set for Dynamically Changing Workloads,"Lipyeow Lim, Min Wang, Jeffrey Scott Vitter",VLDB,2003,,,,,,,,
acm,375761,VQBD: exploring semistructured data,"Sudarshan S. Chawathe, Thomas Baby, Jihwang Yoo",International Conference on Management of Data,2001,,,,,,,,
dblp,conf/vldb/CormodeDIM02,Comparing Data Streams Using Hamming Norms (How to Zero In),"Mayur Datar, Piotr Indyk, S. Muthukrishnan, Graham Cormode",VLDB,2002,,,,,,,,
acm,304186,Snakes and sandwiches: optimal clustering strategies for a data warehouse,"H. V. Jagadish, Laks V. S. Lakshmanan, Divesh Srivastava",International Conference on Management of Data,1999,,,,,,,,
dblp,conf/vldb/Mohan02,Application Servers and Associated Technologies,C. Mohan,VLDB,2002,,,,,,,,
acm,671492,Issues in Network Management in the Next Millennium,"Michael L. Brodie, Surajit Chaudhuri",Very Large Data Bases,1999,,,,,,,,
acm,290607,Database research at Columbia University,"Shih-Fu Chang, Luis Gravano, Gail E. Kaiser, Kenneth A. Ross, Salvatore J. Stolfo",ACM SIGMOD Record,1998,,,,,,,,
dblp,conf/vldb/FlorescuKLP97,Using Probabilistic Information in Data Integration,"Alon Y. Levy, Daniela Florescu, Daphne Koller",VLDB,1997,,,,,,,,
acm,276335,Integrating association rule mining with relational database systems: alternatives and implications,"Sunita Sarawagi, Shiby Thomas, Rakesh Agrawal",International Conference on Management of Data,1998,,,,,,,,
acm,872792,Capturing both types and constraints in data integration,"Michael Benedikt, Chee-Yong Chan, Wenfei Fan, Juliana Freire, Rajeev Rastogi",International Conference on Management of Data,2003,,,,,,,,
dblp,conf/sigmod/PalmerF00,Density Biased Sampling: An Improved Method for Data Mining and Clustering,"Christopher R. Palmer, Christos Faloutsos",SIGMOD Conference,2000,,,,,,,,
dblp,journals/sigmod/Alonso95,Trade Press News,Rafael Alonso,SIGMOD Record,1995,,,,,,,,
acm,253345,Distance-based indexing for high-dimensional metric spaces,"Tolga Bozkaya, Meral Ozsoyoglu",International Conference on Management of Data,1997,,,,,,,,
acm,191872,Optimization of dynamic query evaluation plans,"Richard L. Cole, Goetz Graefe",International Conference on Management of Data,1994,,,,,,,,
dblp,journals/sigmod/BollKB98,Design and Implementation of RMP - A Virtual Electronic Market Place,"Wolfgang Klas, Susanne Boll, Bernard Battaglin",SIGMOD Record,1998,,,,,,,,
dblp,conf/vldb/ChenHWW02,Multi-Dimensional Regression Analysis of Time-Series Data Streams,"Benjamin W. Wah, Yixin Chen, Jianyong Wang, Guozhu Dong, Jiawei Han",VLDB,2002,,,,,,,,
acm,671872,Integrating the UB-Tree into a Database System Kernel,"Frank Ramsak, Volker Markl, Robert Fenk, Martin Zirkel, Klaus Elhardt, Rudolf Bayer",Very Large Data Bases,2000,,,,,,,,
dblp,conf/vldb/Ramanan03,Covering Indexes for XML Queries: Bisimulation - Simulation = Negation,Prakash Ramanan,VLDB,2003,,,,,,,,
acm,304204,Random sampling techniques for space efficient online computation of order statistics of large datasets,"Gurmeet Singh Manku, Sridhar Rajagopalan, Bruce G. Lindsay",International Conference on Management of Data,1999,,,,,,,,
dblp,conf/vldb/GalanisWJD03,Locating Data Sources in Large Distributed Systems,"David J. DeWitt, Leonidas Galanis, Shawn R. Jeffery, Yuan Wang",VLDB,2003,,,,,,,,
dblp,conf/sigmod/DoppelhammerHKK97,Database Performance in the Real World - TPC-D and SAP R/3 (Experience Paper),"Jochen Doppelhammer, Donald Kossmann, Thomas Höppler, Alfons Kemper",SIGMOD Conference,1997,,,,,,,,
dblp,conf/sigmod/ChenGMV02,Fractal prefetching B±Trees: optimizing both cache and disk performance,"Phillip B. Gibbons, Gary Valentin, Todd C. Mowry, Shimin Chen",SIGMOD Conference,2002,,,,,,,,
acm,671853,An Ultra Highly Available DBMS,"Svein-Olaf Hvasshovd, Svein Erik Bratsberg, &#216;ystein Torbj&#248;rnsen",Very Large Data Bases,2000,,,,,,,,
acm,872877,XQuery: a query language for XML,Don Chamberlin,International Conference on Management of Data,2003,,,,,,,,
acm,190646,Metadata for mixed-media access,"Francine Chen, Marti Hearst, Julian Kupiec, Jan Pedersen, Lynn Wilcox",ACM SIGMOD Record,1994,,,,,,,,
dblp,conf/vldb/FukudaMMT96,Constructing Efficient Decision Trees by Using Optimized Numeric Association Rules,"Takeshi Fukuda, Yasuhiko Morimoto, Takeshi Tokuyama, Shinichi Morishita",VLDB,1996,,,,,,,,
dblp,journals/vldb/HelmerM03,A performance study of four index structures for set-valued attributes of low cardinality,"Guido Moerkotte, Sven Helmer",VLDB J.,2003,,,,,,,,
acm,872780,Warping indexes with envelope transforms for query by humming,"Yunyue Zhu, Dennis Shasha",International Conference on Management of Data,2003,,,,,,,,
acm,248615,Extraction of object-oriented structures from existing relational databases,"Shekar Ramanathan, Julia Hodges",ACM SIGMOD Record,1997,,,,,,,,
dblp,journals/sigmod/TanK03,Power efficient data gathering and aggregation in wireless sensor networks,"Ibrahim Korpeoglu, Hüseyin Özgür Tan",SIGMOD Record,2003,,,,,,,,
dblp,conf/sigmod/DeshpandeNGS03,Cache-and-Query for Wide Area Sensor Databases,"Phillip B. Gibbons, Srinivasan Seshan, Suman Kumar Nath, Amol Deshpande",SIGMOD Conference,2003,,,,,,,,
acm,673485,"Calibrating the Query Optimizer Cost Model of IRO-DB, an Object-Oriented Federated Database System","Georges Gardarin, Fei Sha, Zhao-Hui Tang",Very Large Data Bases,1996,,,,,,,,
acm,276313,Efficiently mining long patterns from databases,"Roberto J. Bayardo, Jr.",International Conference on Management of Data,1998,,,,,,,,
dblp,journals/vldb/DesslochHMMT98,"Advanced Data Processing in KRISYS: Modeling Concepts, Implementation Techniques, and Client/Server Issues","Nelson Mendonça Mattos, Joachim Thomas, Theo Härder, Stefan Deßloch, Bernhard Mitschang",VLDB J.,1998,,,,,,,,
acm,335433,The onion technique: indexing for linear optimization queries,"Yuan-Chi Chang, Lawrence Bergman, Vittorio Castelli, Chung-Sheng Li, Ming-Ling Lo, John R. Smith",International Conference on Management of Data,2000,,,,,,,,
dblp,conf/vldb/FrohnLU94,Access to Objects by Path Expressions and Rules,"Jürgen Frohn, Georg Lausen, Heinz Uphoff",VLDB,1994,,,,,,,,
acm,673469,Querying Heterogeneous Information Sources Using Source Descriptions,"Alon Y. Levy, Anand Rajaraman, Joann J. Ordille",Very Large Data Bases,1996,,,,,,,,
dblp,conf/sigmod/GuptaS03,Stream Processing of XPath Queries with Predicates,"Ashish Kumar Gupta, Dan Suciu",SIGMOD Conference,2003,,,,,,,,
dblp,journals/sigmod/Eisenberg96,New Standard for Stored Procedures in SQL,Andrew Eisenberg,SIGMOD Record,1996,,,,,,,,
acm,335381,On-line reorganization in object databases,"Mohana K. Lakhamraju, Rajeev Rastogi, S. Seshadri, S. Sudarshan",International Conference on Management of Data,2000,,,,,,,,
acm,304183,Integration of spatial join algorithms for processing multiple inputs,"Nikos Mamoulis, Dimitris Papadias",International Conference on Management of Data,1999,,,,,,,,
dblp,conf/sigmod/GrossmanQ94,Ptool: A Scalable Persistent Object Manager,"Xiao Qin, Robert L. Grossman",SIGMOD Conference,1994,,,,,,,,
acm,363954,An algebraic approach to static analysis of active database rules,"Elena Baralis, Jennifer Widom",ACM Transactions on Database Systems (TODS),2000,,,,,,,,
dblp,journals/sigmod/ReichB98,A Componentized Architecture for Dynamic Electronic Markets,"Israel Ben-Shaul, Benny Reich",SIGMOD Record,1998,,,,,,,,
acm,950485,Aurora: a new model and architecture for data stream management,"Daniel J. Abadi, Don Carney, Ugur &#199;etintemel, Mitch Cherniack, Christian Convey, Sangdon Lee, Michael Stonebraker, Nesime Tatbul, Stan Zdonik",The VLDB Journal &mdash, The International Journal on Very Large Data Bases,2003,,,,,,,
acm,253404,GeoMiner: a system prototype for spatial data mining,"Jaiwei Han, Krzysztof Koperski, Nebojsa Stefanovic",International Conference on Management of Data,1997,,,,,,,,
dblp,conf/vldb/LeslieJBY95,Efficient Search of Multi-Dimensional B-Trees,"Dave Birdsall, Hedieh Yaghmai, Harry Leslie, Rohit Jain",VLDB,1995,,,,,,,,
dblp,journals/vldb/PacittiS00,Update Propagation Strategies to Improve Freshness in Lazy Master Replicated Databases,"Eric Simon, Esther Pacitti",VLDB J.,2000,,,,,,,,
acm,564783,GEA: a toolkit for gene expression analysis,"Jessica M. Phan, Raymond Ng",International Conference on Management of Data,2002,,,,,,,,
dblp,conf/sigmod/Shivakumar03,Google in a Box - Building the Google Search Appliance,Narayanan Shivakumar,SIGMOD Conference,2003,,,,,,,,
dblp,conf/vldb/AmielBDS94,Supporting Exceptions to Schema Consistency to Ease Schema Evolution in OODBMS,"Eric Dujardin, Eric Simon, Marie-Jo Bellosta, Eric Amiel",VLDB,1994,,,,,,,,
acm,375796,Will database researchers have any role in data security? (panel session),"Arnon Rosenthal, Klaus Dittrich, Jim Donahue, Bill Maimone",International Conference on Management of Data,2001,,,,,,,,
acm,765852,Query processing and optimization in Oracle Rdb,"Gennady Antoshenkov, Mohamed Ziauddin",The VLDB Journal &mdash, The International Journal on Very Large Data Bases,1996,,,,,,,
acm,764221,WaveCluster: a wavelet-based clustering approach for spatial data in very large databases,"Gholamhosein Sheikholeslami, Surojit Chatterjee, Aidong Zhang",The VLDB Journal &mdash, The International Journal on Very Large Data Bases,2000,,,,,,,
acm,765526,"Advanced data processing in KRISYS: modeling concepts, implementation techniques, and client/server issues","Stefan De&#223;loch, Theo H&#228;rder, Nelson Mattos, Bernhard Mitschang, Joachim Thomas",The VLDB Journal &mdash, The International Journal on Very Large Data Bases,1998,,,,,,,
acm,304582,The CCUBE constraint object-oriented database system,"Alexander Brodsky, Victor E. Segal, Jia Chen, Paval A. Exarkhopoulo",International Conference on Management of Data,1999,,,,,,,,
dblp,conf/sigmod/DraperHW01,The Nimble Integration Engine,"Daniel S. Weld, Alon Y. Halevy, Denise Draper",SIGMOD Conference,2001,,,,,,,,
acm,191947,Red brick warehouse: a read-mostly RDBMS for open SMP platforms,Phillip M. Fernandez,International Conference on Management of Data,1994,,,,,,,,
acm,505049,Editorial,Richard Snodgrass,ACM Transactions on Database Systems (TODS),2001,,,,,,,,
dblp,conf/vldb/SetzerZ94,New Concurrency Control Algorithms for Accessing and Compacting B-Trees,"Andrea Zisman, V. W. Setzer",VLDB,1994,,,,,,,,
acm,568520,Locally adaptive dimensionality reduction for indexing large time series databases,"Kaushik Chakrabarti, Eamonn Keogh, Sharad Mehrotra, Michael Pazzani",ACM Transactions on Database Systems (TODS),2002,,,,,,,,
dblp,journals/sigmod/PhatakSSS96,"Database Research at the Indian Institute of Technology, Bombay","S. Seshadri, Nandlal L. Sarda, D. B. Phatak, S. Sudarshan",SIGMOD Record,1996,,,,,,,,
acm,673152,DB2 Query Parallelism: Staging and Implementation,Yun Wang,Very Large Data Bases,1995,,,,,,,,
